<?xml version="1.0" encoding="UTF-8"?>

<recipe:recipe xmlns:recipe="http://www.swordsandsorcery.com/recipe" xmlns:xsi="http://www.w3.org/2001/XMLSchema-instance"
               xsi:schemaLocation="http://www.swordsandsorcery.com/recipe ../schema.xsd">
    <recipe:id>15</recipe:id>
    <recipe:name>Wolf skin (cured)</recipe:name>
    <recipe:type>LEATHERWORKING_CURING</recipe:type>
    <recipe:chance>100</recipe:chance>
    <recipe:requirement-list>
        <recipe:skill-requirement>
            <recipe:skill>LEATHERWORKING</recipe:skill>
            <recipe:amount>5</recipe:amount>
        </recipe:skill-requirement>
    </recipe:requirement-list>
    <recipe:ingredient-list>
        <recipe:ingredient>
            <recipe:id>70</recipe:id>
            <recipe:amount>1</recipe:amount>
        </recipe:ingredient>
        <recipe:ingredient>
            <recipe:id>75</recipe:id>
            <recipe:amount>1</recipe:amount>
        </recipe:ingredient>
    </recipe:ingredient-list>
    <recipe:reward-list>
        <recipe:reward>
            <recipe:id>16</recipe:id>
            <recipe:amount>1</recipe:amount>
        </recipe:reward>
    </recipe:reward-list>
    <recipe:experience-list>
        <recipe:experience>
            <recipe:skill>LEATHERWORKING</recipe:skill>
            <recipe:amount>35</recipe:amount>
        </recipe:experience>
    </recipe:experience-list>
</recipe:recipe>