<?xml version="1.0" encoding="UTF-8"?>

<recipe:recipe xmlns:recipe="http://www.swordsandsorcery.com/recipe"
               xmlns:xsi="http://www.w3.org/2001/XMLSchema-instance"
               xsi:schemaLocation="http://www.swordsandsorcery.com/recipe ../schema.xsd">
    <recipe:id>75</recipe:id>
    <recipe:name>Robinia Staff</recipe:name>
    <recipe:type>IMBUING</recipe:type>
    <recipe:chance>100</recipe:chance>
    <recipe:requirement-list>
        <recipe:skill-requirement>
            <recipe:skill>IMBUING</recipe:skill>
            <recipe:amount>1</recipe:amount>
        </recipe:skill-requirement>
        <recipe:resource-requirement>
            <recipe:resource>MANA</recipe:resource>
            <recipe:amount>8</recipe:amount>
        </recipe:resource-requirement>
    </recipe:requirement-list>
    <recipe:ingredient-list>
        <recipe:ingredient>
            <recipe:id>231</recipe:id>
            <recipe:amount>1</recipe:amount>
        </recipe:ingredient>
    </recipe:ingredient-list>
    <recipe:reward-list>
        <recipe:reward>
            <recipe:id>36</recipe:id>
            <recipe:amount>1</recipe:amount>
        </recipe:reward>
    </recipe:reward-list>
    <recipe:experience-list>
        <recipe:experience>
            <recipe:skill>IMBUING</recipe:skill>
            <recipe:amount>40</recipe:amount>
        </recipe:experience>
    </recipe:experience-list>
</recipe:recipe>