<?xml version="1.0" encoding="UTF-8"?>

<recipe:recipe xmlns:recipe="http://www.swordsandsorcery.com/recipe" xmlns:xsi="http://www.w3.org/2001/XMLSchema-instance"
               xsi:schemaLocation="http://www.swordsandsorcery.com/recipe ../schema.xsd">
    <recipe:id>74</recipe:id>
    <recipe:name>Bloodlord's Pride</recipe:name>
    <recipe:type>SMITHING</recipe:type>
    <recipe:chance>100</recipe:chance>
    <recipe:requirement-list>
        <recipe:skill-requirement>
            <recipe:skill>SMITHING</recipe:skill>
            <recipe:amount>15</recipe:amount>
        </recipe:skill-requirement>
        <recipe:item-requirement>
            <recipe:id>8</recipe:id>
            <recipe:amount>1</recipe:amount>
        </recipe:item-requirement>
    </recipe:requirement-list>
    <recipe:ingredient-list>
        <recipe:ingredient>
            <recipe:id>5</recipe:id>
            <recipe:amount>16</recipe:amount>
        </recipe:ingredient>
        <recipe:ingredient>
            <recipe:id>212</recipe:id>
            <recipe:amount>1</recipe:amount>
        </recipe:ingredient>
        <recipe:ingredient>
            <recipe:id>116</recipe:id>
            <recipe:amount>1</recipe:amount>
        </recipe:ingredient>
    </recipe:ingredient-list>
    <recipe:reward-list>
        <recipe:reward>
            <recipe:id>230</recipe:id>
            <recipe:amount>1</recipe:amount>
        </recipe:reward>
    </recipe:reward-list>
    <recipe:experience-list>
        <recipe:experience>
            <recipe:skill>SMITHING</recipe:skill>
            <recipe:amount>250</recipe:amount>
        </recipe:experience>
    </recipe:experience-list>
</recipe:recipe>